name;brand
Сыр Брест-Литовск Классический нарезка 45% БЗМЖ 150г;Брест-Литовск
Сыр творожный Савушкин Воздушный сливочный 60% 150г;Савушкин
Сыр Viola Маасдам полутвердый нарезка 45% БЗМЖ 120г;Viola
Сыр Сыробогатов Швейцарский 45% БЗМЖ 180г;Сыробогатов
Сыр Galbani Моцарелла 45% БЗМЖ 125г;Galbani
Сыр плавленый Карат Дружба 45% 90г;Карат
Сыр Сваля Тильзитер нарезка 45% 125г;Сваля
Сыр мягкий Ришелье Бри с белой плесенью 45% БЗМЖ 125г;Ришелье
Сыр Предгорье Кавказа Ассорти 45% 110г;Предгорье Кавказа
Сыр Сыробогатов Дружба плавленый 50% БЗМЖ 80г;Сыробогатов
Сыр плавленый Viola Сливочный 50% 200г;Viola
Сыр Магнит Белорусское золото 45% весовой;Магнит
Сыр Брест-Литовск Сливочный 50% 200г;Брест-Литовск
Сыр Viola Бутербродный нарезка 45% 120г;Viola
Сыр Belster Parmesan нарезка 40% БЗМЖ 135г;Belster
Сыр Hochland Сливочный плавленый 55% БЗМЖ 200г;Hochland
Сыр Liebendorf с грибами плавленый 55% БЗМЖ 400г;Liebendorf
Сыр полутвердый Grunlander Hochland Чеддер 50% кусок 180г;Grunlander
Сыр Sveza творожный с зеленью 60% 150г;Sveza
Сыр Брест-Литовск маасдам 45% БЗМЖ 200г;Брест-Литовск
Сыр Endorf Tulyere твердый 50% БЗМЖ 200г;Endorf
Плавленый продукт Дружба 50% 100г;нет
Сыр Вкус & Польза Буррата мягкий 50% БЗМЖ 380г;Вкус & Польза
Сыр плавленый Карат с луком для супа 45% БЗМЖ 90г;Карат
Сыр Село Зеленое Гауда Премиум нарезка 40% 130г;Село Зеленое
Сыр творожный Hochland овощи-гриль 60% БЗМЖ 140г;Hochland
Сыр Брест-Литовск Российский 50% 200г;Брест-Литовск
Сыр творожный Экомилк 60% БЗМЖ 400г;Экомилк
Сыр Сыробогатов Альпийское утро плавленый 45% 400г;Сыробогатов
Сыр Предгорье Кавказа Чечил-спагетти с укропом 45% 110г;Предгорье Кавказа
Сыр Верещагин Верещагинский Зеленый полутвердый 50% БЗМЖ;Верещагин
Сыр творожный Violette сливочный 70% БЗМЖ 180г;Violette
Сыр Ларец с грецкими орехами 45% БЗМЖ 245г;Ларец
Сыр Брест-Литовск Российский 50% 150г;Брест-Литовск
Сыр Брест-Литовск Тильзитер 45% 200г;Брест-Литовск
Сыр творожный Violette с креветками 70% 140г;Violette
Сыр Радость Вкуса Топленое молочко нарезка 45% БЗМЖ 125г;Радость вкуса
Сыр Сырцееды копченый 30% БЗМЖ 23г;Сырцееды
Сыр Hochland Grunlander Чеддер полутвердый нарезка 50% БЗМЖ 130г;Hochland
Сыр Pretto маскарпоне 80% БЗМЖ 250г;Pretto
Сыр  Истринская сыроварня Олега Сироты Истринский 50% БЗМЖ;Истринская сыроварня Олега Сироты
Сыр Liebendorf Гауда полутвердый 45% БЗМЖ;Liebendorf
Сыр Мега Мастер Чечил Боровский 45% 100г;Мега Мастер
Сыр Радость вкуса Топленочка с фенугреком 45% БЗМЖ 180г;Радость вкуса
Сыр Фетакса без рассола 45% 200г;Фетакса
Сыр плавленый Viola ассорти Финское избранное 45% 130г;Viola
Сыр Сыробогатов Для бургера плавленый слайсы 25% БЗМЖ 112г;Сыробогатов
Сыр Жаворонки Янтарь плавленый пастеризованный 45% 80г;Жаворонки
Сыр Савушкин Sveza Воздушный с авокадо творожный 60% БЗМЖ 150г;Sveza
Продукт плавленый Переяславль сливочный 45% 130г;Переяславль
Сыр Almette с белыми грибами творожный 60% БЗМЖ 150г;Almette
Сыр плавленый Экомилк сливочный 55% 400г;Экомилк
Сыр Вкус & Польза Моцарелла шарики 45% БЗМЖ 180г;Вкус & Польза
Сыр плавленый Viola Классический с салями 35% 190г;Viola
Сыр Радость вкуса Топленочка 45% БЗМЖ 180г;Радость вкуса
Сыр Landkaas Тильзитер 45% весовой;Landkaas
Сыр Liebendorf Маасдам полутвердый 45% БЗМЖ;Liebendorf
Сыр Поставы Городок Пармезан гранд 45% 200г;Поставы Городок
Сыр Premiere of taste Моцарелла 40% 200г;Premiere of taste
Сыр творожный Hochland с чесноком 60% БЗМЖ 140г;Hochland
Сыр Село Зеленое Тильзитер 50% 400г;Село Зеленое
Сыр плавленый Viola Сливочный 35% БЗМЖ 130г;Viola
Сыр Natura Сливочный 45% БЗМЖ 400г;Natura
Сыр Ламбер легкий 30% весовой;Ламбер
Сыр твёрдый LiebenDorf Голландский тертый 45% БЗМЖ 200г;Liebendorf
Сыр Свежий Ряд Косичка копченый 40% БЗМЖ 100г;Свежий Ряд
Сыр Kesidis Халлуми Традиционный для гриля рассольный 40% БЗМЖ 200г;Kesidis
Сыр Брест-Литовск Тильзитер нарезка 45% 130г;Брест-Литовск
Сыр Тысяча Озер Сливочный нарезка 50% БЗМЖ 125г;Тысяча Озер
Сыр Hochland с грибами плавленый 55% БЗМЖ 200г;Hochland
Сыр Sliiivki колбасный копченый янтарный плавленый 40% БЗМЖ;Sliiivki
Сыр полутвердый ЭкоНива Тильзитер 50% БЗМЖ 400г;ЭкоНива
Сыр плавленый Viola Сливочный 50% 400г;Viola
Сыр Vitalat Перлини копченый 40% БЗМЖ 100г;Vitalat
Сыр Laplandia Emmental полутвердый 45% БЗМЖ 120г;Laplandia
Сыр Брест-Литовск Монастырский 45% БЗМЖ 200г;Брест-Литовск
Сыр Laplandia Edam нарезка 45% БЗМЖ 120г;Laplandia
Сыр Радость вкуса Веселый Роджер 20% БЗМЖ 160г;Радость вкуса
Сыр Premiere of taste мягкий с белой плесенью Камамбер 125г;Premiere of taste
Сыр Экомилк Фетика рассольный 40% 220г;Экомилк
Сыр Свежий Ряд Чечил спагетти копченый БЗМЖ 100г;Свежий Ряд
Ассорти сыров Laime Пармезан-Маасдам-Чеддер 45% БЗМЖ 120г;Laime
Сыр Брест-Литовск Классический 45% нарезка 150г;Брест-Литовск
Сыр плавленый Viola Cливочный 45% 140г;Viola
Сыр Natura Сливочный 45% БЗМЖ 200г;Natura
Сыр Савушкин Sveza Моцарелла мягкий 45% БЗМЖ 250г;Савушкин
Сыр Моя цена Голландский 45% весовой;Моя цена
Сыр Viola плавленный с лисичками 50% 200г;Viola
Сыр Danke Сливочный 45% 400г;Danke
Сыр Савушкин Воздушный сливочный творожный 60% БЗМЖ 150г;Савушкин
Сыр Excelsior Sardo 45% БЗМЖ 180г;Excelsior
Сыр Cheese Gallery Маасдам нарезка 45% БЗМЖ 125г;Cheese Gallery
Пармезан Trattoria di Maestro Turatti твердый 40% БЗМЖ;Trattoria di Maestro Turatti
Сыр Sernur cheese Халумис из коровьего молока 50% БЗМЖ 200г;Sernur cheese
Сыр Liebendorf Гауда полутвердый нарезка БЗМЖ 150г;Liebendorf
Сыр Liebendorf Тильзитер 45% БЗМЖ;Liebendorf
Сыр плавленый Переяславль ассорти 55% 140г;Переяславль
Сыр Свежий Ряд Пошехонский полутвердый 45% БЗМЖ;Свежий Ряд
Сыр плавленый Hochland с ветчиной 55% 400г;Hochland
Продукт По-Российски Классический на основе растительного жира 50% весовой;нет
Сыр Sveza творожный Сливочный 60% 150г;Sveza
Сыр Viola плавленый сливочный 50% БЗМЖ 400г;Viola
Сыр Gruyere твердый 49% БЗМЖ;нет
Сыр Hochland Грюнландер полутвердый 50% БЗМЖ 400г;Hochland
Сыр Ламбер Гурмэ 55% БЗМЖ 230г;Ламбер
Сыр плавленый Hochland сливочный 55% 400г;Hochland
Сыр Тысяча Озер легкий 15% БЗМЖ 200г;Тысяча Озер
Сыр Oldenburger Protein с грецким орехом нарезка 30% БЗМЖ 125г;Oldenburger
Сыр Умалат Сулугуни молодой слоистый 45% БЗМЖ 200г;Умалат
Сыр Hochland С грибами плавленый 35% БЗМЖ 100г;Hochland
Сыр Sambiel с голубой плесенью 50% БЗМЖ 100г;Sambiel
Сыр Ecomilk Fetica греческий традиционный мягкий рассольный 40% БЗМЖ 275г;Экомилк
Сыр Моя цена Голландский Тертый 45% 200г;Моя цена
Сыр Бонджорно Рикотта с ванилью мягкий 30% БЗМЖ 180г;Бонджорно
Сыр Коса копченый 40% весовой;нет
Сыр Ламбер 50% весовой;Ламбер
Сыр плавленый Карат Шоколадный 30% 230г;Карат
Сыр плавленый Hochland Чизбургер ломтики 45% 150г;Hochland
Сыр LiebenDorf Маасдам полутвердый нарезка БЗМЖ 150г;Liebendorf
Сыр творожный Hochland с зеленью 60% 140г;Hochland
Сыр Село Зеленое Гауда Премиум 40% БЗМЖ 160г;Село Зеленое
Сыр Поставы Городок Голландский премиум нарезка 45% 150г;Поставы Городок
Сыр творожный Almette сливочный 60% БЗМЖ 150г;Almette
Сыр Экомилк творожный 60% 400г;Экомилк
Пармезан Dolce Granto 40% БЗМЖ 200г;Dolce Granto
Сыр Montarell Камамбер мягкий 45% БЗМЖ 125г;Montarell
Сыр Hochland Сырная классика со швейцарским сыром плавленый 50% БЗМЖ 200г;Hochland
Сыр Violette Сливочный творожный 70% БЗМЖ 140г;Violette
Сыр Ларец с грецкими орехами 45% 245г;Ларец
Сыр плавленый President с ветчиной 45% 400г;President
Сыр Rokler пастообразный сливочный 45% 370г;Rokler 
Сыр Premiere of taste Пармезан весовой;Premiere of taste
Сыр творожный Hochland сливочный 60% 140г;Hochland 
Сыр La Paulina Чеддер твердый 48% БЗМЖ 180г;La Paulina
Сыр М Свежесть Сулугуни 45% весовой;М Свежесть
Сыр Natura Сливочный нарезка 45% БЗМЖ 300г;Natura 
Сыр Вкус & Польза Страчателла мягкий 50% БЗМЖ 200г;Вкус & Польза
Сыр Моя цена Российский весовой;Моя цена
Сыр Вкус & Польза Рикотта 45% БЗМЖ 180г;Вкус & Польза
Сыр плавленый Hochland Сэндвич ломтики 45% БЗМЖ 150г;Hochland 
Сыр Белебеевский Классический полутвердый 45% БЗМЖ 190г;Белебеевский 
Сыр Emandhof Hard extra 40% БЗМЖ;Emandhof
Сыр Тысяча озер Легкий нарезка БЗМЖ 15% 125г;Тысяча озер
Сыр Pretto Моцарелла Чильеджина 45% 100г;Pretto 
Сыр Предгорье Кавказа Адыгейский 45% весовой;Предгорье Кавказа
Сыр Premiere of taste мягкий с белой плесенью Бри 125г;Premiere of taste
Сыр плавленый Сыробогатов с ветчиной 50% 200г;Сыробогатов 
Сыр Сыробогатов с беконом плавленый  50% БЗМЖ 200г;Сыробогатов 
Сыр полутвердый Брест-Литовск Российский 50% БЗМЖ 200г;Брест-Литовск
Сыр рассольный Sveza Брынза 45% 200г;Sveza 
Сыр Hochland Гриль Чиз плавленый ломтики 40% БЗМЖ 150г;Hochland 
Сыр Тэрэз копченый Балыковый 100г;Тэрэз
Сыр Сиртаки Classic рассольный 35% БЗМЖ 330г;Сиртаки 
Сыр творожный Almette Сливочный 60% 150г;Almette 
Сыр President Камамбер мягкий с белой плесенью 45% БЗМЖ 125г;President
Сыр Liebendorf Сливочный плавленый пастообразный 55% БЗМЖ 400г;Liebendorf 
Сыр Grandblu Сливочный с голубой плесенью 56% БЗМЖ 100г;Grandblu 
Продукт рассольный Сиртаки Original 55% 200г;Сиртаки 
Сыр Hochland Сливочный творожный 60% БЗМЖ 220г;Hochland 
Сыр творожный Liebendorf сливочный 60% БЗМЖ 140г;Liebendorf 
Сыр Laime Пармезан выдержанный 40% весовой;Laime 
Сыр ЭкоНива Momente aus Schollbrunn полутвердый 50% 200г;ЭкоНива 
Сыр Pretto Моцарелла для бутербродов 45% БЗМЖ 200г;Pretto 
Сыр Белебеевский 45% 190г;Белебеевский 
Сыр Брест-Литовск Королевский полутвёрдый 45% 200г;Брест-Литовск
Сыр плавленый копченый Город сыра Гурманский нарезка 40% БЗМЖ 150г;Город сыра
Сыр Dolce Granto Пармезан тертый 40% БЗМЖ 150г;Dolce Granto
Сыр Фетакса без рассола 45% БЗМЖ 200г;Фетакса
Сыр Белебеевский Российский 50% БЗМЖ 120г;Белебеевский 
Сыр творожный Almette с огурцами и зеленью 60% БЗМЖ 150г;Almette 
Сыр Liebendorf творожный с зеленью 60% БЗМЖ 140г;Liebendorf 
Сыр Брест-Литовск Классический 45% 200г;Брест-Литовск
Сыр Hochland С зеленью творожный 60% БЗМЖ 220г;Hochland 
Сыр Belster Пармезан 40% 195г;Belster 
Сыр Савушкин Sveza прованские травы творожный нарезка 60% БЗМЖ 150г;Савушкин
Сыр ЭкоНива Классический полутвердый 50% 180г;ЭкоНива
Сыр Брест-Литовск Маасдам 45% 130г;Брест-Литовск
Сыр Верещагин Верещагинский полутвердый 50% БЗМЖ;Верещагин 
Сыр Violette Лосось творожный 70% БЗМЖ 140г;Violette 
Сыр Viola Маасдам полутвердый 45% БЗМЖ 180г;Viola 
Сыр Viola Бутербродный полутвердый нарезка 45% БЗМЖ 120г;Viola 
Сыр Oldenburger с грецким орехом полутвердый нарезка 45% БЗМЖ 125г;Oldenburger 
Сыр Вкус & Польза Голландский 45% БЗМЖ;Вкус & Польза
"Сыр Hochland Ассорти сливочный, с ветчиной, с грибами плавленый 55% БЗМЖ 140г";Hochland 
Сыр Вкус & Польза Маскарпоне 80% БЗМЖ 250г;Вкус & Польза
Сыр творожный Pretto с травами 65% 140г;Pretto 
Сыр La Paulina Гойя 40% БЗМЖ;La Paulina
Сыр Delissir Хоритаки плавленый 30% БЗМЖ 180г;Delissir 
Сыр плавленый Viola с лисичками 50% БЗМЖ 200г;Viola 
Фета Sveza нежная 45% БЗМЖ 250г;Sveza 
Сыр Montarell Бри мягкий 60% БЗМЖ 125г;Montarell
Сыр Город сыра Гурманский нарезка 40% 150г;Город сыра
Сыр Liebendorf Чизбургер плавленый 45% БЗМЖ 130г;Liebendorf 
Сыр творожный Hochland с маринованными огурцами 60% БЗМЖ 140г;Hochland 
Сыр Брест-Литовск Голландский 45% 200г;Брест-Литовск
Сыр Сернурский СЗ Сернурская Легенда 45% 300г;Сернурский СЗ
Сыр Истринская сыроварня Олега Сироты Губернаторский 50% БЗМЖ;Истринская сыроварня Олега Сироты
Сыр Ламбер 50% БЗМЖ 230г;Ламбер 
Сыр Василеостровская сыроварня Пряди домашний с паприкой 45% 100г;Василеостровская сыроварня
Сыр Hochland Сливочный плавленый 55% БЗМЖ 400г;Hochland 
Сыр Карат Шоколадно-Ореховый десертный плавленный 30% БЗМЖ 230г;Карат 
Сыр Варвара-Краса Сметанковый 50% 160г;Варвара-Краса
Сыр Брест-Литовск Легкий 35% 200г;Брест-Литовск
Сыр Василеостровская сыроварня Пряди домашние копченые 45% 100г;Василеостровская сыроварня
Сыр Брест-Литовск Маасдам 45% 200г;Брест-Литовск
Сыр ЭкоНива Щучанский полутвердый 50% 300г;ЭкоНива 
Сыр Landkaas Гауда 45% весовой;Landkaas 
Сыр Сырцееды копченый со вкусом томата 30% БЗМЖ 23г;Сырцееды 
Сыр Умалат Сулугуни палочки 45% БЗМЖ 120г;Умалат 
Плавленый продукт Рязанский ЗПС колбасный копченый 45% 300г;Рязанский ЗПС
Сыр Pretto творожный сливочный 65% 140г;Pretto 
Сыр Cream Nuvo творожный Professional сливочный 65% 380г;Cream Nuvo
Сыр Laplandia Сливочный фасованный полутвердый 45% БЗМЖ 180г;Laplandia 
Сыр плавленый President Сливочный 45% 400г;President
Сыр Liebendorf Эдам полутвердый 45% БЗМЖ;Liebendorf 
Сыр Hochland творожный для кулинарии 65% БЗМЖ 400г;Hochland 
Сыр Hochland С ветчиной плавленый 55% БЗМЖ 200г;Hochland 
Сыр Natura Сливочный 45% 300г;Natura 
Сыр Liebendorf Тильзитер твердый нарезка 48% БЗМЖ 150г;Liebendorf 
Сыр Pretto Рикотта 45% 200г;Pretto 
Сыр Grandblu Creamy с голубой плесенью 56% 100г;Grandblu 
Сыр Pretto Маскарпоне 80% 250г;Pretto 
Сыр Брест-Литовск Финский 45% 200г;Брест-Литовск
Сыр творожный Viola Сливочный 70% БЗМЖ 140г;Viola 
Сыр М Свежесть Косичка копченая 40% 100г;М Свежесть
Сыр President Чечил белый спагетти 35% БЗМЖ 100г;President
Сыр творожный Almette с зеленью 60% БЗМЖ 150г;Almette 
Сыр Экомилк творожный 60% 350г;Экомилк 